ies,rango_modal,graduados_rango_modal,total_graduados
SERVICIO NACIONAL DE APRENDIZAJE-SENA-,"Entre 1 y 1,5 SMMLV",211088,453057
CORPORACION UNIVERSITARIA MINUTO DE DIOS -UNIMINUTO-,"Entre 1 y 1,5 SMMLV",30539,102780
UNIVERSIDAD NACIONAL DE COLOMBIA,"Entre 2,5 y 4 SMMLV",16094,70423
PONTIFICIA UNIVERSIDAD JAVERIANA,Entre 4 y 6 SMMLV,12952,61355
FUNDACION UNIVERSITARIA DEL AREA ANDINA,Entre 4 y 6 SMMLV,18801,61129
POLITECNICO GRANCOLOMBIANO,"Entre 2,5 y 4 SMMLV",15710,58526
UNIVERSIDAD COOPERATIVA DE COLOMBIA,"Entre 2,5 y 4 SMMLV",14160,55739
UNIVERSIDAD LIBRE,"Entre 2,5 y 4 SMMLV",12229,54163
FUNDACION UNIVERSITARIA LOS LIBERTADORES,Entre 4 y 6 SMMLV,29840,52691
UNIVERSIDAD DE SANTANDER - UDES,Entre 4 y 6 SMMLV,20564,49369
UNIVERSIDAD NACIONAL ABIERTA Y A DISTANCIA UNAD,"Entre 2,5 y 4 SMMLV",12069,47055
UNIVERSIDAD DE ANTIOQUIA,"Entre 2,5 y 4 SMMLV",13073,46522
UNIVERSIDAD EXTERNADO DE COLOMBIA,Más de 9 SMMLV,12001,45090
UNIVERSIDAD SANTO TOMAS,"Entre 2,5 y 4 SMMLV",9184,40608
UNIVERSIDAD PONTIFICIA BOLIVARIANA,"Entre 2,5 y 4 SMMLV",9352,40471
UNIVERSIDAD DE LOS ANDES,Más de 9 SMMLV,13200,38819
UNIVERSIDAD DEL TOLIMA,"Entre 1 y 1,5 SMMLV",10206,37220
UNIVERSIDAD PEDAGOGICA Y TECNOLOGICA DE COLOMBIA - UPTC,"Entre 2,5 y 4 SMMLV",10255,36913
UNIVERSIDAD DEL VALLE,"Entre 2,5 y 4 SMMLV",8332,35825
UNIVERSIDAD DE PAMPLONA,"Entre 2,5 y 4 SMMLV",8596,30089
COLEGIO MAYOR DE NUESTRA SEÑORA DEL ROSARIO,Más de 9 SMMLV,6978,29440
CORPORACION UNIFICADA NACIONAL DE EDUCACION SUPERIOR-CUN-,"Entre 1 y 1,5 SMMLV",9210,28941
UNIVERSIDAD DEL NORTE,"Entre 2,5 y 4 SMMLV",6531,28785
UNIVERSIDAD INDUSTRIAL DE SANTANDER,"Entre 2,5 y 4 SMMLV",6276,28462
UNIVERSIDAD EAFIT-,Más de 9 SMMLV,6917,28434
UNIVERSIDAD DE LA SABANA,Más de 9 SMMLV,6982,28402
UNIVERSIDAD DISTRITAL-FRANCISCO JOSE DE CALDAS,"Entre 2,5 y 4 SMMLV",7029,27135
FUNDACION UNIVERSIDAD DE BOGOTA - JORGE TADEO LOZANO,"Entre 2,5 y 4 SMMLV",6829,27134
CORPORACION UNIVERSITARIA REMINGTON,"Entre 1 y 1,5 SMMLV",7644,27014
UNIVERSIDAD DE SAN BUENAVENTURA,"Entre 2,5 y 4 SMMLV",6242,25321
UNIVERSIDAD FRANCISCO DE PAULA SANTANDER,"Entre 1 y 1,5 SMMLV",7726,25054
UNIVERSIDAD MILITAR-NUEVA GRANADA,"Entre 2,5 y 4 SMMLV",5629,23909
UNIVERSIDAD SANTIAGO DE CALI,"Entre 2,5 y 4 SMMLV",5818,23714
UNIVERSIDAD CATOLICA DE COLOMBIA,Entre 4 y 6 SMMLV,5413,23703
INSTITUTO TECNOLOGICO METROPOLITANO,"Entre 1,5 y 2,5 SMMLV",6764,23638
UNIVERSIDAD EAN,Entre 4 y 6 SMMLV,4903,23066
UNIVERSIDAD ECCI,"Entre 2,5 y 4 SMMLV",6149,22926
UNIVERSIDAD DE MEDELLIN,Entre 4 y 6 SMMLV,5452,22901
UNIVERSIDAD DE CARTAGENA,"Entre 2,5 y 4 SMMLV",6000,22229
UNIVERSIDAD SERGIO ARBOLEDA,Entre 4 y 6 SMMLV,4988,22167
UNIVERSIDAD DEL ATLANTICO,"Entre 2,5 y 4 SMMLV",6772,21658
UNIVERSIDAD DEL MAGDALENA - UNIMAGDALENA,"Entre 2,5 y 4 SMMLV",6506,21006
UNIVERSIDAD DE LA SALLE,"Entre 2,5 y 4 SMMLV",5691,20926
UNIVERSIDAD SIMON BOLIVAR,"Entre 1,5 y 2,5 SMMLV",5205,20885
UNIVERSIDAD ANTONIO NARIÑO,"Entre 2,5 y 4 SMMLV",4759,20315
UNIDADES TECNOLOGICAS DE SANTANDER,"Entre 1 y 1,5 SMMLV",8111,19399
POLITECNICO COLOMBIANO JAIME ISAZA CADAVID,"Entre 2,5 y 4 SMMLV",4973,19007
UNIVERSIDAD DEL QUINDIO,"Entre 1 y 1,5 SMMLV",5415,18917
UNIVERSIDAD AUTONOMA DE BUCARAMANGA-UNAB-,"Entre 2,5 y 4 SMMLV",3719,18830
FUNDACION UNIVERSITARIA SAN MARTIN,"Entre 2,5 y 4 SMMLV",4331,18264
FUNDACION UNIVERSITARIA JUAN DE CASTELLANOS,Entre 4 y 6 SMMLV,11824,18036
UNIVERSIDAD TECNOLOGICA DE PEREIRA - UTP,"Entre 2,5 y 4 SMMLV",3997,17720
UNIVERSIDAD DE CALDAS,"Entre 2,5 y 4 SMMLV",4190,17662
UNIVERSIDAD EL BOSQUE,Entre 4 y 6 SMMLV,4032,17127
UNIVERSIDAD POPULAR DEL CESAR,"Entre 2,5 y 4 SMMLV",4808,16942
UNIVERSIDAD CATOLICA LUIS AMIGO,"Entre 2,5 y 4 SMMLV",4659,16571
UNIVERSIDAD LA GRAN COLOMBIA,"Entre 2,5 y 4 SMMLV",4118,16136
UNIVERSIDAD AUTONOMA DEL CARIBE- UNIAUTONOMA,"Entre 1 y 1,5 SMMLV",3644,15872
TECNOLOGICO DE ANTIOQUIA,"Entre 1,5 y 2,5 SMMLV",4906,15582
UNIVERSIDAD CENTRAL,"Entre 2,5 y 4 SMMLV",3965,15197
CORPORACION UNIVERSIDAD PILOTO DE COLOMBIA,"Entre 2,5 y 4 SMMLV",3653,15170
UNIVERSIDAD DE CUNDINAMARCA-UDEC,"Entre 1,5 y 2,5 SMMLV",3888,14800
CORPORACION UNIVERSIDAD DE LA COSTA CUC,"Entre 2,5 y 4 SMMLV",3776,14653
UNIVERSIDAD PEDAGOGICA NACIONAL,"Entre 2,5 y 4 SMMLV",4291,14514
CORPORACION UNIVERSITARIA IBEROAMERICANA,"Entre 1 y 1,5 SMMLV",4662,14497
UNIVERSIDAD DE CORDOBA,"Entre 1 y 1,5 SMMLV",3991,14343
ESCUELA SUPERIOR DE ADMINISTRACION PUBLICA-ESAP-,"Entre 2,5 y 4 SMMLV",3300,13838
UNIVERSIDAD AUTONOMA DE OCCIDENTE,"Entre 1 y 1,5 SMMLV",3072,13564
UNIVERSIDAD CATOLICA DE MANIZALES,Entre 4 y 6 SMMLV,5375,13093
UNIVERSIDAD MANUELA BELTRAN-UMB-,"Entre 2,5 y 4 SMMLV",3474,12289
UNIVERSIDAD ICESI,Entre 4 y 6 SMMLV,2547,12203
UNIVERSIDAD DEL CAUCA,"Entre 2,5 y 4 SMMLV",3517,12176
UNIVERSIDAD DE MANIZALES,Entre 4 y 6 SMMLV,2934,12156
UNIVERSIDAD SURCOLOMBIANA,"Entre 2,5 y 4 SMMLV",2930,11928
CORPORACION UNIVERSITARIA DEL CARIBE - CECAR,"Entre 2,5 y 4 SMMLV",3517,11686
FUNDACION UNIVERSITARIA TECNOLOGICO COMFENALCO - CARTAGENA,"Entre 1 y 1,5 SMMLV",3745,11582
UNIVERSIDAD TECNOLOGICA DE BOLIVAR,"Entre 2,5 y 4 SMMLV",2560,11073
UNIVERSIDAD DE NARIÑO,"Entre 2,5 y 4 SMMLV",3038,11023
FUNDACION UNIVERSITARIA COMPENSAR,"Entre 1,5 y 2,5 SMMLV",3286,10903
UNIVERSIDAD-COLEGIO MAYOR DE CUNDINAMARCA,"Entre 2,5 y 4 SMMLV",3277,10387
UNIVERSIDAD TECNOLOGICA DEL CHOCO-DIEGO LUIS CORDOBA,"Entre 2,5 y 4 SMMLV",4663,10135
FUNDACION UNIVERSIDAD AUTONOMA DE COLOMBIA -FUAC-,"Entre 2,5 y 4 SMMLV",2378,9745
UNIVERSIDAD DEL SINU - ELIAS BECHARA ZAINUM - UNISINU -,"Entre 2,5 y 4 SMMLV",2380,9590
UNIVERSIDAD AUTONOMA LATINOAMERICANA-UNAULA-,Entre 4 y 6 SMMLV,2446,9425
UNIVERSIDAD CES,"Entre 2,5 y 4 SMMLV",2126,9381
UNIVERSIDAD DE LA GUAJIRA,"Entre 2,5 y 4 SMMLV",2911,9356
UNIVERSIDAD MARIANA,"Entre 2,5 y 4 SMMLV",2364,8399
INSTITUCION UNIVERSITARIA PASCUAL BRAVO,"Entre 1,5 y 2,5 SMMLV",2340,8374
UNIVERSIDAD DE INVESTIGACION Y DESARROLLO - UDI,"Entre 1 y 1,5 SMMLV",2110,8017
FUNDACION UNIVERSITARIA-CEIPA-,"Entre 2,5 y 4 SMMLV",2089,7908
FUNDACION UNIVERSITARIA ESUMER,"Entre 2,5 y 4 SMMLV",2213,7724
UNIVERSIDAD ESCUELA COLOMBIANA DE INGENIERIA JULIO GARAVITO,"Entre 2,5 y 4 SMMLV",1724,7698
"FUNDACION CENTRO COLOMBIANO DE ESTUDIOS PROFESIONALES, -F C E C E P ","Entre 1 y 1,5 SMMLV",2913,7575
CORPORACION UNIVERSITARIA AMERICANA,"Entre 1 y 1,5 SMMLV",2235,7563
UNIVERSITARIA AGUSTINIANA- UNIAGUSTINIANA,"Entre 1,5 y 2,5 SMMLV",2039,7497
UNIVERSIDAD METROPOLITANA,"Entre 2,5 y 4 SMMLV",1996,7487
INSTITUCION UNIVERSITARIA ANTONIO JOSE CAMACHO,"Entre 1,5 y 2,5 SMMLV",2338,7416
UNIVERSIDAD AUTONOMA DE MANIZALES,"Entre 2,5 y 4 SMMLV",1682,7334
FUNDACION UNIVERSITARIA PARA EL DESARROLLO HUMANO - UNINPAHU,"Entre 1,5 y 2,5 SMMLV",1975,7123
CORPORACION UNIVERSITARIA UNITEC,"Entre 2,5 y 4 SMMLV",1747,6987
UNIVERSIDAD CATOLICA DE ORIENTE -UCO,"Entre 2,5 y 4 SMMLV",2264,6903
UNIVERSIDAD DE CIENCIAS APLICADAS Y AMBIENTALES - UDCA,"Entre 2,5 y 4 SMMLV",2064,6699
UNIVERSIDAD DE LA AMAZONIA,"Entre 2,5 y 4 SMMLV",2081,6571
CORPORACION UNIVERSITARIA RAFAEL NUÑEZ,"Entre 1,5 y 2,5 SMMLV",1779,6532
UNIVERSIDAD DE IBAGUE,"Entre 1 y 1,5 SMMLV",1559,6518
FUNDACION UNIVERSIDAD DE AMERICA,"Entre 2,5 y 4 SMMLV",1501,6487
UNIVERSIDAD DE LOS LLANOS,"Entre 2,5 y 4 SMMLV",1815,6413
POLITECNICO INTERNACIONAL INSTITUCION DE EDUCACION SUPERIOR,"Entre 1 y 1,5 SMMLV",3229,6377
UNIVERSIDAD DE BOYACA UNIBOYACA,"Entre 2,5 y 4 SMMLV",1819,6370
FUNDACION UNIVERSITARIA MARIA CANO,"Entre 2,5 y 4 SMMLV",1913,6320
FUNDACION UNIVERSITARIA DE CIENCIAS DE LA SALUD,"Entre 2,5 y 4 SMMLV",2097,6300
UNIVERSIDAD DE SUCRE,"Entre 1 y 1,5 SMMLV",1818,6199
FUNDACION UNIVERSITARIA SAN MATEO - SAN MATEO EDUCACION SUPERIOR,"Entre 1,5 y 2,5 SMMLV",2055,6156
CORPORACION UNIVERSITARIA LATINOAMERICANA - CUL,"Entre 1 y 1,5 SMMLV",2239,5441
FUNDACION UNIVERSITARIA KONRAD LORENZ,"Entre 2,5 y 4 SMMLV",1495,5334
INSTITUCION UNIVERSITARIA DE BARRANQUILLA - IUB,"Entre 1 y 1,5 SMMLV",1935,5251
FUNDACION UNIVERSITARIA ANTONIO DE AREVALO - UNITECNAR,"Entre 1 y 1,5 SMMLV",2515,5245
INSTITUCION UNIVERSITARIA VISION DE LAS AMERICAS,"Entre 2,5 y 4 SMMLV",1269,5071
COLEGIO DE ESTUDIOS SUPERIORES DE ADMINISTRACION-CESA-,Más de 9 SMMLV,2331,4995
FUNDACION UNIVERSITARIA CATOLICA LUMEN GENTIUM - UNICATOLICA - CALI,"Entre 1,5 y 2,5 SMMLV",1518,4914
CORPORACION POLITECNICO DE LA COSTA ATLANTICA,"Entre 1 y 1,5 SMMLV",1513,4825
UNIVERSIDAD INCCA DE COLOMBIA,"Entre 2,5 y 4 SMMLV",1150,4633
COLEGIO MAYOR DE ANTIOQUIA,"Entre 1,5 y 2,5 SMMLV",1332,4512
UNIVERSIDAD CATOLICA DE PEREIRA,"Entre 1 y 1,5 SMMLV",1072,4471
FUNDACION UNIVERSITARIA AGRARIA DE COLOMBIA -UNIAGRARIA-,"Entre 2,5 y 4 SMMLV",1170,4435
CORPORACION UNIVERSITARIA REPUBLICANA,"Entre 2,5 y 4 SMMLV",1034,4425
CORPORACION UNIVERSITARIA DE CIENCIA Y DESARROLLO - UNICIENCIA,"Entre 2,5 y 4 SMMLV",1099,4356
CORPORACION UNIVERSITARIA AUTONOMA DE NARIÑO -AUNAR-,"Entre 1 y 1,5 SMMLV",1685,4303
FUNDACION UNIVERSITARIA CATOLICA DEL NORTE,"Entre 2,5 y 4 SMMLV",1359,4262
UNIVERSIDAD CESMAG - UNICESMAG,"Entre 1 y 1,5 SMMLV",1724,4259
CORPORACION UNIVERSITARIA DEL HUILA-CORHUILA-,"Entre 1 y 1,5 SMMLV",1312,4065
UNIDAD CENTRAL DEL VALLE DEL CAUCA,"Entre 1 y 1,5 SMMLV",1005,4026
FUNDACION UNIVERSITARIA DE SAN GIL - UNISANGIL -,"Entre 1 y 1,5 SMMLV",1097,3963
UNIVERSIDAD EIA,Más de 9 SMMLV,1034,3906
INSTITUCION UNIVERSITARIA ESCOLME,"Entre 1,5 y 2,5 SMMLV",1161,3891
CORPORACION UNIVERSITARIA DEL META - UNIMETA,"Entre 1 y 1,5 SMMLV",943,3862
FUNDACION UNIVERSITARIA MONSERRATE -UNIMONSERRATE,"Entre 1,5 y 2,5 SMMLV",1110,3848
INSTITUCION UNIVERSITARIA SALAZAR Y HERRERA,"Entre 1,5 y 2,5 SMMLV",1060,3754
ESCUELA TECNOLOGICA INSTITUTO TECNICO CENTRAL,"Entre 1,5 y 2,5 SMMLV",1071,3603
FUNDACION ACADEMIA DE DIBUJO PROFESIONAL,"Entre 1 y 1,5 SMMLV",1877,3585
INSTITUTO UNIVERSITARIO DE LA PAZ,"Entre 1 y 1,5 SMMLV",1057,3544
FUNDACION CENTRO DE INVESTIGACION DOCENCIA Y CONSULTORIA ADMINISTRATIVA-F-CIDCA-,"Entre 1 y 1,5 SMMLV",1063,3421
INSTITUCION UNIVERSITARIA DE ENVIGADO,"Entre 2,5 y 4 SMMLV",819,3264
FUNDACION DE EDUCACION SUPERIOR SAN JOSE -FESSANJOSE-,"Entre 1,5 y 2,5 SMMLV",1025,3233
INSTITUTO TOLIMENSE DE FORMACION TECNICA PROFESIONAL,"Entre 1 y 1,5 SMMLV",1517,3213
FUNDACION UNIVERSITARIA JUAN N CORPAS,Entre 4 y 6 SMMLV,923,2964
CORPORACION INTERNACIONAL PARA EL DESARROLLO EDUCATIVO -CIDE-,"Entre 1 y 1,5 SMMLV",1125,2782
FUNDACION UNIVERSITARIA DE POPAYAN,"Entre 1 y 1,5 SMMLV",885,2737
INSTITUCION UNIVERSITARIA MAYOR DE CARTAGENA,"Entre 1 y 1,5 SMMLV",1248,2680
INSTITUTO DE EDUCACION TECNICA PROFESIONAL DE ROLDANILLO,"Entre 1 y 1,5 SMMLV",1285,2655
INSTITUCION UNIVERSITARIA EAM,"Entre 1 y 1,5 SMMLV",981,2557
FUNDACION UNIVERSITARIA HORIZONTE,"Entre 1,5 y 2,5 SMMLV",872,2510
CORPORACION UNIVERSITARIA DE ASTURIAS,"Entre 2,5 y 4 SMMLV",641,2382
CORPORACION UNIVERSITARIA ADVENTISTA - UNAC,"Entre 2,5 y 4 SMMLV",686,2337
ESCUELA NACIONAL DEL DEPORTE,"Entre 1 y 1,5 SMMLV",793,2334
INSTITUCION UNIVERSITARIA MARCO FIDEL SUAREZ - IUMAFIS,"Entre 1,5 y 2,5 SMMLV",791,2323
CORPORACION UNIVERSITARIA CENTRO SUPERIOR - UNICUCES,"Entre 1,5 y 2,5 SMMLV",776,2276
CORPORACION ESCUELA DE ARTES Y LETRAS,"Entre 1 y 1,5 SMMLV",634,2161
TECNOLOGICA FITEC,"Entre 1 y 1,5 SMMLV",1115,2160
CORPORACION UNIVERSAL DE INVESTIGACION Y TECNOLOGIA -CORUNIVERSITEC-,"Entre 1 y 1,5 SMMLV",790,2099
INSTITUCION UNIVERSITARIA DE COLOMBIA - UNIVERSITARIA DE COLOMBIA,"Entre 2,5 y 4 SMMLV",451,1996
CORPORACION UNIVERSITARIA COMFACAUCA - UNICOMFACAUCA,"Entre 1 y 1,5 SMMLV",750,1993
FUNDACION UNIVERSITARIA CLARETIANA - UNICLARETIANA,"Entre 2,5 y 4 SMMLV",699,1983
CORPORACION TECNOLOGICA INDUSTRIAL COLOMBIANA - TEINCO,"Entre 1,5 y 2,5 SMMLV",554,1982
INSTITUCION UNIVERSITARIA COLEGIOS DE COLOMBIA - UNICOC,"Entre 1 y 1,5 SMMLV",691,1977
COLEGIO MAYOR DEL CAUCA,"Entre 1 y 1,5 SMMLV",786,1937
FUNDACION UNIVERSITARIA EMPRESARIAL DE LA CAMARA DE COMERCIO DE BOGOTA- UNIEMPRESARIAL,"Entre 2,5 y 4 SMMLV",470,1875
CORPORACION UNIVERSITARIA DE SANTA ROSA DE CABAL-UNISARC-,"Entre 1 y 1,5 SMMLV",632,1848
CORPORACION UNIVERSITARIA ANTONIO JOSE DE SUCRE - CORPOSUCRE,"Entre 1 y 1,5 SMMLV",624,1836
CORPORACION DE EDUCACION SUPERIOR DEL LITORAL,"Entre 1 y 1,5 SMMLV",830,1831
FUNDACION DE ESTUDIOS SUPERIORES COMFANORTE -F E S C -,"Entre 1 y 1,5 SMMLV",882,1792
"CORPORACION UNIVERSITARIA DE CIENCIAS EMPRESARIALES, EDUCACION Y SALUD -UNICORSALUD-","Entre 1,5 y 2,5 SMMLV",596,1693
INSTITUTO TECNICO NACIONAL DE COMERCIO SIMON RODRIGUEZ - INTENALCO,"Entre 1 y 1,5 SMMLV",893,1641
CORPORACION UNIVERSITARIA AUTONOMA DEL CAUCA,"Entre 1 y 1,5 SMMLV",461,1592
INSTITUTO SUPERIOR DE EDUCACION RURAL-ISER-,"Entre 2,5 y 4 SMMLV",518,1554
CORPORACION UNIVERSITARIA LASALLISTA,"Entre 2,5 y 4 SMMLV",417,1534
CORPORACION INSTITUTO SUPERIOR DE EDUCACION SOCIAL-ISES-,"Entre 1 y 1,5 SMMLV",659,1406
FUNDACION UNIVERSITARIA SANITAS,"Entre 2,5 y 4 SMMLV",456,1403
FUNDACION UNIVERSITARIA COLOMBO INTERNACIONAL - UNICOLOMBO,"Entre 1,5 y 2,5 SMMLV",471,1390
CORPORACION UNIVERSITARIA REGIONAL DEL CARIBE -IAFIC-,"Entre 1 y 1,5 SMMLV",597,1322
FUNDACION TECNOLOGICA AUTONOMA DEL PACIFICO,"Entre 1 y 1,5 SMMLV",538,1319
UNIVERSIDAD DEL PACIFICO,"Entre 1 y 1,5 SMMLV",535,1254
INSTITUTO NACIONAL DE FORMACION TECNICA PROFESIONAL - HUMBERTO VELASQUEZ GARCIA,"Entre 1 y 1,5 SMMLV",422,1191
FUNDACION UNIVERSITARIA COLOMBO GERMANA,"Entre 1 y 1,5 SMMLV",489,1185
CORPORACION COLEGIATURA COLOMBIANA,"Entre 1 y 1,5 SMMLV",271,1177
UNIVERSIDAD INTERNACIONAL DEL TROPICO AMERICANO - UNITROPICO,"Entre 1 y 1,5 SMMLV",343,1134
FUNDACION UNIVERSITARIA CAFAM -UNICAFAM,"Entre 1,5 y 2,5 SMMLV",334,1130
FUNDACION ESCUELA COLOMBIANA DE REHABILITACION,"Entre 1,5 y 2,5 SMMLV",337,1103
CORPORACION UNIVERSITARIA DE SABANETA - UNISABANETA,"Entre 2,5 y 4 SMMLV",252,1071
CORPORACION ESCUELA TECNOLOGICA DEL ORIENTE,"Entre 1 y 1,5 SMMLV",309,972
FUNDACION TECNOLOGICA AUTONOMA DE BOGOTA-FABA-,"Entre 1,5 y 2,5 SMMLV",322,963
INSTITUTO TECNOLOGICO DEL PUTUMAYO,"Entre 1 y 1,5 SMMLV",361,946
CORPORACION UNIVERSITARIA CENDA,"Entre 1 y 1,5 SMMLV",339,854
CORPORACION ACADEMIA TECNOLOGICA DE COLOMBIA -ATEC-,"Entre 1 y 1,5 SMMLV",289,852
LCI - FUNDACION TECNOLOGICA,"Entre 1 y 1,5 SMMLV",269,768
CORPORACION UNIVERSITARIA EMPRESARIAL ALEXANDER VON HUMBOLDT - CUE,"Entre 2,5 y 4 SMMLV",227,751
INSTITUCION UNIVERSITARIA LATINA - UNILATINA,"Entre 1,5 y 2,5 SMMLV",216,715
CORPORACION EDUCATIVA -ITAE-,"Entre 1 y 1,5 SMMLV",327,713
CORPORACION INTERAMERICANA DE EDUCACION SUPERIOR-CORPOCIDES,"Entre 1 y 1,5 SMMLV",385,697
CORPORACION UNIVERSITARIA EMPRESARIAL DE SALAMANCA,"Entre 1 y 1,5 SMMLV",287,691
CORPORACION ESCUELA SUPERIOR DE ADMINISTRACION Y ESTUDIOS TECNOLOGICOS- EAE,"Entre 1 y 1,5 SMMLV",302,679
CORPORACION INSTITUTO DE ADMINISTRACION Y FINANZAS - CIAF,"Entre 1 y 1,5 SMMLV",346,674
FUNDACION DE EDUCACION SUPERIOR UPARSISTEM,"Entre 1 y 1,5 SMMLV",285,653
CENTRO DE CONOCIMIENTO ALEJANDRIA - ALEJANDRIA,"Entre 1,5 y 2,5 SMMLV",152,650
COLEGIO INTEGRADO NACIONAL ORIENTE DE CALDAS - IES CINOC,"Entre 1 y 1,5 SMMLV",358,640
INSTITUCION UNIVERSITARIA BELLAS ARTES Y CIENCIAS DE BOLIVAR,"Entre 1 y 1,5 SMMLV",235,609
INSTITUTO DEPARTAMENTAL DE BELLAS ARTES,"Entre 1 y 1,5 SMMLV",206,608
INSTITUTO NACIONAL DE FORMACION TECNICA PROFESIONAL DE SAN JUAN DEL CESAR,"Entre 1 y 1,5 SMMLV",213,605
CORPORACION UNIVERSITARIA TALLER CINCO CENTRO DE DISEÑO,"Entre 1 y 1,5 SMMLV",181,602
FUNDACION UNIVERSITARIA NAVARRA - UNINAVARRA,"Entre 2,5 y 4 SMMLV",191,593
FUNDACION DE EDUCACION SUPERIOR NUEVA AMERICA,"Entre 1 y 1,5 SMMLV",265,589
FUNDACION UNIVERSITARIA INTERNACIONAL DE LA RIOJA - UNIR,"Entre 2,5 y 4 SMMLV",170,588
CORPORACION UNIVERSITARIA DE COLOMBIA IDEAS,"Entre 2,5 y 4 SMMLV",128,564
CORPORACION UNIVERSITARIA U DE COLOMBIA,"Entre 1,5 y 2,5 SMMLV",193,539
CORPORACION TECNOLOGICA DE BOGOTA - CTB,"Entre 1,5 y 2,5 SMMLV",204,524
CORPORACION DE ESTUDIOS TECNOLOGICOS DEL NORTE DEL VALLE,"Entre 1 y 1,5 SMMLV",265,520
INSTITUTO TECNICO AGRICOLA ITA,"Entre 1 y 1,5 SMMLV",244,494
CORPORACION ACADEMIA SUPERIOR DE ARTES,"Entre 1 y 1,5 SMMLV",175,457
CORPORACION UNIVERSITARIA REFORMADA - CUR -,"Entre 1 y 1,5 SMMLV",161,437
FUNDACION DE ESTUDIOS SUPERIORES - MONSEÑOR ABRAHAM ESCUDERO MONTOYA - FUNDES,"Entre 2,5 y 4 SMMLV",114,428
CORPORACION DE EDUCACION DEL NORTE DEL TOLIMA - COREDUCACION,"Entre 1 y 1,5 SMMLV",199,422
FUNDACION DE EDUCACION SUPERIOR ALBERTO MERANI,"Entre 1 y 1,5 SMMLV",165,416
FUNDACION ESCUELA TECNOLOGICA DE NEIVA - JESUS OVIEDO PEREZ -FET,"Entre 1 y 1,5 SMMLV",163,396
"CORPORACION EDUCATIVA INSTITUTO TECNICO SUPERIOR DE ARTES, IDEARTES","Entre 1 y 1,5 SMMLV",122,388
FUNDACION UNIVERSITARIA COMFAMILIAR RISARALDA,"Entre 1 y 1,5 SMMLV",167,377
FUNDACION UNIVERSITARIA BELLAS ARTES,"Entre 2,5 y 4 SMMLV",96,373
ESCUELA DE TECNOLOGIAS DE ANTIOQUIA -ETA-,"Entre 1,5 y 2,5 SMMLV",113,361
TECNOLOGICO DE ARTES DEBORA ARANGO INSTITUCION REDEFINIDA,"Entre 1 y 1,5 SMMLV",169,359
INSTITUCION UNIVERSITARIA COLOMBO AMERICANA - UNICA,"Entre 2,5 y 4 SMMLV",115,345
FUNDACION UNIVERSITARIA CERVANTES SAN AGUSTIN - UNICERVANTES,"Entre 2,5 y 4 SMMLV",93,344
FUNDACION UNIVERSITARIA SAN ALFONSO- FUSA-,"Entre 1,5 y 2,5 SMMLV",103,333
CORPORACION UNIFICADA HISPANOAMERICANA DE EDUCACION SUPERIOR,"Entre 1 y 1,5 SMMLV",174,308
CORPORACION POLITECNICO COLOMBO ANDINO,"Entre 1 y 1,5 SMMLV",99,303
CONSERVATORIO DEL TOLIMA,"Entre 2,5 y 4 SMMLV",84,278
INSTITUTO SUPERIOR DE CIENCIAS SOCIALES Y ECONOMICO FAMILIARES-ICSEF-,"Entre 1 y 1,5 SMMLV",122,269
TECNOLOGICO COREDI,"Entre 1 y 1,5 SMMLV",147,258
INSTITUTO CARO Y CUERVO,Entre 4 y 6 SMMLV,102,258
CORPORACION TECNOLOGICA INDOAMERICA,"Entre 1 y 1,5 SMMLV",130,242
CORPORACION JOHN F KENNEDY,"Entre 1 y 1,5 SMMLV",65,231
FUNDACION UNIVERSITARIA SEMINARIO TEOLOGICO BAUTISTA INTERNACIONAL,"Entre 1 y 1,5 SMMLV",77,216
UNIVERSITARIA VIRTUAL INTERNACIONAL,"Entre 1 y 1,5 SMMLV",78,216
FUNDACION INTERAMERICANA TECNICA-FIT-,"Entre 1 y 1,5 SMMLV",65,214
CORPORACION EDUCATIVA INTERNACIONAL - CEI -,"Entre 1 y 1,5 SMMLV",73,202
INSTITUTO NACIONAL DE FORMACION TECNICA PROFESIONAL DE SAN ANDRES Y PROVIDENCIA - INFOTEP,"Entre 1,5 y 2,5 SMMLV",75,201
CORPORACION TECNOLOGICA CATOLICA DE OCCIDENTE - TECOC -,"Entre 1 y 1,5 SMMLV",82,188
FUNDACION DE ESTUDIOS SUPERIORES UNIVERSITARIOS DE URABA ANTONIO ROLDAN BETANCUR,"Entre 1 y 1,5 SMMLV",79,185
CORPORACION COLSUBSIDIO EDUCACION TECNOLOGICA - CET,"Entre 1,5 y 2,5 SMMLV",70,177
INSTITUCION UNIVERSITARIA DIGITAL DE ANTIOQUIA -IU DIGITAL,"Entre 2,5 y 4 SMMLV",47,162
FUNDACION UNIVERSITARIA SEMINARIO BIBLICO DE COLOMBIA - FUSBC,"Entre 2,5 y 4 SMMLV",58,157
INSTITUTO DE EDUCACION EMPRESARIAL-IDEE-,"Entre 1 y 1,5 SMMLV",80,150
CORPORACION CENTRO DE ESTUDIOS ARTISTICOS Y TECNICOS-CEART-,"Entre 1 y 1,5 SMMLV",59,137
CORPORACION DE EDUCACION SUPERIOR SURAMERICA,"Entre 1 y 1,5 SMMLV",72,135
FUNDACION ESCUELA COLOMBIANA DE HOTELERIA Y TURISMO-ECOTET-,"Entre 1 y 1,5 SMMLV",41,118
"ESEIT - ESCUELA SUPERIOR DE EMPRESA, INGENIERIA Y TECNOLOGIA","Entre 2,5 y 4 SMMLV",37,117
POLITECNICO SANTAFE DE BOGOTA,"Entre 1 y 1,5 SMMLV",46,116
FUNDACION CENTRO UNIVERSITARIO DE BIENESTAR RURAL,"Entre 2,5 y 4 SMMLV",48,114
CORPORACION REGIONAL DE EDUCACION SUPERIOR-CRES-DE CALI,"Entre 1 y 1,5 SMMLV",62,113
UNION AMERICANA DE EDUCACION SUPERIOR- UNION AMERICANA,"Entre 1 y 1,5 SMMLV",47,112
POLITECNICO ICAFT,"Entre 1 y 1,5 SMMLV",44,109
ESCUELA INTERNACIONAL DE ESTUDIOS SUPERIORES - INTER,"Entre 1 y 1,5 SMMLV",59,98
UNIVERSIDAD AUTONOMA INDIGENA INTERCULTURAL - UAIIN,"Entre 1,5 y 2,5 SMMLV",67,87
FUNDACION DE EDUCACION SUPERIOR ESATEC,"Entre 1 y 1,5 SMMLV",39,85
CORPORACION UNIVERSITARIA PARA EL DESARROLLO EMPRESARIAL Y SOCIAL - MISION PAZ ,"Entre 1 y 1,5 SMMLV",45,83
CORPORACION BOLIVARIANA DE EDUCACION SUPERIOR - CORBES -,"Entre 1 y 1,5 SMMLV",48,68
FUNDACION UNIVERSITARIA LUIS G PAEZ - UNIPAEZ,"Entre 2,5 y 4 SMMLV",16,67
FUNDACION UNIVERSITARIA CIEO - UNICIEO,"Entre 1 y 1,5 SMMLV",19,64
INSTITUCION DE EDUCACION TECNOLOGICA INTERNACIONAL - UNIVERSAE,"Entre 1 y 1,5 SMMLV",31,63
CORPORACION TECNOLOGICA DE EDUCACION SUPERIOR SAPIENZA -CTE-,"Entre 1 y 1,5 SMMLV",23,58
CORPORACION TECNOLOGICO SUPERIOR,Entre 4 y 6 SMMLV,7,26
FUNDACION UNIVERSITARIA CATOLICA DEL SUR - UNICATOLICA DEL SUR,"Entre 1 y 1,5 SMMLV",15,23
FUNDACION UNIVERSITARIA COMFENALCO SANTANDER,"Entre 1,5 y 2,5 SMMLV",10,18
"ESCUELA SUPERIOR DE OFTALMOLOGIA, INSTITUTO BARRAQUER DE AMERICA",Más de 9 SMMLV,6,13
UNIDAD TECNOLOGICA DEL MAGDALENA MEDIO - UTEM -,"Entre 1,5 y 2,5 SMMLV",3,7
CORPORACION TECNOLOGICO COPACABANA - TECO -,"Entre 1 y 1,5 SMMLV",2,5
CORPORACION UNIVERSITARIA AUTONOMA DEL NORTE,"Entre 2,5 y 4 SMMLV",2,3
CORPORACION TECNOLOGICA SUPERIOR SIGLO XXI,1 SMMLV,1,1
